Colombia,COL,Development,Coverage of social assistance for people who use drugs (not including housing),No,n/a,0,"It is also urgent to limit the mechanisms that reproduce inequality and inequity caused largely by differential access to the structure of opportunities and welfare networks. […] Likewise, the challenges of development and its gaps make it necessary to work on the recovery and strengthening of human and social capital, which is deeply violated by consumption and its unfavorable consequences {Política Nacional Para La Reduccíon Del Consumo De Sustancias Psicoactivas Y Su Impacto, 2007, p.10} ~ From this perspective, public policy in the area of psychoactive substance use, in addition to improving the physical and mental health conditions of those already involved, should aim to alleviate the associated suffering and to develop conditions that allow control over the factors that put at risk the options of life, the development of capacities, the health and the well-being. This means transcending the service delivery approach and engaging in the overall debate on the country's development agenda. An agenda that prioritizes the search for conditions for peace, security and overcoming poverty and inequality. {Política Nacional Para La Reduccíon Del Consumo De Sustancias Psicoactivas Y Su Impacto, 2007, p.11} ~ At the same time, it is hoped to optimize the distribution of scarce and finite resources (technical and financial), thus maximizing welfare, and guaranteeing the right of to access all opportunities to prevent, mitigate and overcome the conditions and factors that make the risks and vulnerability to the consumption of SPA more dynamic. {Política Nacional Para La Reduccíon Del Consumo De Sustancias Psicoactivas Y Su Impacto, 2007, p.18} ~ Finally, social inclusion will be used as a tool to prevent, mitigate and, above all, overcome or deal with the ""after effects"" of having an active commitment to alcohol or other substances. {Política Nacional Para La Reduccíon Del Consumo De Sustancias Psicoactivas Y Su Impacto, 2007, p.19} ~ In the fields of rehabilitation and social inclusion, it is proposed to respond to the difficulties that many entities face for reasons of infrastructure and qualification of human resources, as well as reduce barriers commonly encountered by rehabilitated consumers to reintegrate into social life and productivity. {Política Nacional Para La Reduccíon Del Consumo De Sustancias Psicoactivas Y Su Impacto, 2007, p.22} ~ In addition to intersectoral and interinstitutional coordination and cooperation, as well as families and communities educated and sensitized to the importance of rehabilitation and social inclusion {Política Nacional Para La Reduccíon Del Consumo De Sustancias Psicoactivas Y Su Impacto, 2007, p.22} ~ All this also puts us in a scenario in which political action is based on respect for human and social rights, promoting every action that involves improving social cohesion and the inclusion of groups in vulnerable situations, ensuring access to media and real opportunities for social integration in both prevention and impact responses. {Política Nacional Para La Reduccíon Del Consumo De Sustancias Psicoactivas Y Su Impacto, 2007, p.25} ~ Within an integrated framework of development as a country agenda, social work requires the effective development of networks and synergies between policies and institutions in terms of social welfare, health promotion and strengthening of the aspects that contribute to human and social capital. {Política Nacional Para La Reduccíon Del Consumo De Sustancias Psicoactivas Y Su Impacto, 2007, p.25} ~ Social protection, thus understood, seeks to provide means to help the population more effectively manage the risks, and prevent the loss of well-being and depletion in human capital (asset sales, irreversible damages) for the most vulnerable groups, as well as the eventual loss of income due to a multiplicity of risks. To this end, prevention, mitigation and improvement strategies are put in place, and informal, market and public supply systems are energized with the participation of multiplicity of actors, including individuals, households, institutions, levels of government and the market. {Política Nacional Para La Reduccíon Del Consumo De Sustancias Psicoactivas Y Su Impacto, 2007, p.15} ~ The population living in a rural area of the country, represents a factor that increases the risk of planting illicit crops. As a result, it seeks to articulate an inclusive policy based on improving the income of this population segment, drawing three lines (i) improving access to physical and financial assets, (ii) Developing partnerships to generate economies of scale and (iii) to provide technical assistance to improve productivity. {Política Nacional contra las Drogas, 2010-2014, p.9} ~  Strategies also promote social inclusion - employment, linked to the treatment programs for problematic consumption, in order to restore violated rights and strengthen the social inclusion of those accessing actions overcoming addictions. {Política Nacional contra las Drogas, 2010-2014, p.55} ~ Building capacity in communities to implement productive licit projects that will generate licit income {Política Nacional contra las Drogas, 2010-2014, p.62} ~ Provide consumers in the process of overcoming dependence, with employment opportunities, education, and social inclusion. {Política Nacional contra las Drogas, 2010-2014, p.71} ~ "
Colombia,COL,Development,Number of households enrolled in alternative development,Yes,"Number of Families cared for in alternative development: Baseline in 2013 = 8535: Goal for 2018 = 40,000 {Bases del Plan Nacional de Desarrollo, 2014-2018, p.385} ~ Number of supported alternative development organizations: Baseline in 2013 = 75: Goal for 2018 = 190 {Bases del Plan Nacional de Desarrollo, 2014-2018, p.385} ~ ",2,"Similarly, illicit-free zones will be implemented, in order to promote alternative development, rural development and economic integration, so as to protect the environmental asset and expand the legal agricultural frontier, improving the capacity to generate income, and to encourage incentives that discourage the planting of illicit crops. {Política Nacional contra las Drogas, 2010-2014, p.9} ~ The table shows that efforts in reducing illicit crops have been oriented towards spraying and manual eradication, accompanied by alternative development programs aimed at promoting culture legality, and generating licit alternatives for agricultural production growers {Política Nacional contra las Drogas, 2010-2014, p.22} ~ Consolidation of illicit free crops regions: Seeks the final eradication, prevention of replanting illicit substance, and avoiding the displacement of the population involved in illicit crops to other regions of the country, by offering different legal alternatives. Among these regions are the Pilot Knot Plan of Paramillo: South of Córdoba, Bajo Cauca Antioqueño and Southeastern Antioqueño, Plan of Integral Consolidation of the Macarena-Meta. {Política Nacional contra las Drogas, 2010-2014, p.30} ~   Promote rural development actions, involving productive and environmental alternatives, which will relocate the population to live in environmentally strategic areas {Política Nacional contra las Drogas, 2010-2014, p.54} ~ Similarly, land titling strategies will be developed, promoted, and integrated in rural areas where there were eradicated illicit crops, making a joint work with CCIC {Política Nacional contra las Drogas, 2010-2014, p.55} ~ In this vein, alternative development in Colombia is geared towards supporting the State's fight against drugs and the social recovery of the territory, through the generation of self-sustaining processes and opportunities for change towards a licit life, and by promoting a culture of legality in areas with a presence or that are at risk of being affected by illicit crops, or in areas with an influence of illicit drug trafficking, in order to reduce their negative impact, generate welfare conditions for the communities involved, and to promote processes for the recovery, conservation and sustainable use of natural resources. {Política Nacional contra las Drogas, 2010-2014, p.61} ~ Create mechanisms to formalize access to land and mechanisms to promote the Ministry of Agriculture and Rural Development. {Política Nacional contra las Drogas, 2010-2014, p.62} ~ Sustainable alternative development programs will be strengthened, as effective tool to improve results in the fight to eradicate illicit crops, especially in those areas where communities cooperate in implementing manual eradication programs voluntary and turn them into a life choice for families tillers {Política Nacional contra las Drogas, 2010-2014, p.55} ~ Development and updating of the National Narcotics Statute, with the aim of differentiating criminal action against illicit crops, giving specificity to crimes in relation to the individual's role in the drug production chain and updating the legal framework for Development of alternative development programs in communities willing to abandon their links to illicit crops. {Bases del Plan Nacional de Desarrollo, 2014-2018, p.384} ~ "
Colombia,COL,Development,Other/too general goals/metrics,No,n/a,0,"For this reason, it is necessary to strengthen and create mechanisms for joint planning of actions through networks and support structures, which in turn, facilitate and promote social and community mobilization and participation {Política Nacional Para La Reduccíon Del Consumo De Sustancias Psicoactivas Y Su Impacto, 2007, p.8} ~ It is also necessary to promote the articulation of actions with the country development project, to avoid fragmentation and isolation, to provide transparency in management and to facilitate mechanisms for accountability, to promote constitutional guarantees and to protect the essence of the Social State of Law, based on the effective exercise of the rights of political, civil, economic, social and cultural citizenship, with universal character, for the whole population {Política Nacional Para La Reduccíon Del Consumo De Sustancias Psicoactivas Y Su Impacto, 2007, p.10} ~  Therefore, fostering opportunities for belonging to groups in conditions of vulnerability (prevention), as well as for groups already involved and recovered (mitigation, overcoming) will contribute to the construction and strengthening of social capital and contribute to overcome inequalities {Política Nacional Para La Reduccíon Del Consumo De Sustancias Psicoactivas Y Su Impacto, 2007, p.16} ~ At the macrosocial level, it is proposed to carry out actions of social development, normative, cultural and regulatory deconstruction, control and social responsibility. It is recognized that this is one of the levels in which the greatest challenges are faced, since in many cases structural aspects are difficult to control. However, it is necessary to recognize that one of the factors with greater protective power is the opportunity to develop in a ""pro-social"" environment, sufficiently rewarding, to provide means and resources for the development of assets, to offer a cultural and formal protection that discourages the demand for SPA and protects against harmful effects. {Política Nacional Para La Reduccíon Del Consumo De Sustancias Psicoactivas Y Su Impacto, 2007, p.20} ~ Therefore, the exercise of building a policy for the country in the field of social protection implies an inescapable commitment to guarantee rights, the development of capacities and opportunities, the fight against inequity and lack of social integration. This would make a difference in aspects that strongly influence the choice of substance use as a way of life for many children and young people of our country. Any effort in this regard contributes to the promotion and protection of human capital or, in other words and as stated in Law 789 of 2002, to improve the quality of life and reduce the vulnerability of citizens {Política Nacional Para La Reduccíon Del Consumo De Sustancias Psicoactivas Y Su Impacto, 2007, p.10} ~ Develop strategies to encourage the reintegration of people with controlled mental pathology. {Política Nacional Para la Reducción del Consumo de SPA y su Impacto - Sistema de Gestión Estratégica: Un camino para el montaje de las políticas y planes territoriales de reducción del consumo de sustancias psicoactivas y su impacto, 2008, p.13} ~ Regarding the income received by coca growers, some studies have shown that they do not reach the monthly minimum wage. This fact, demonstrates the need to support public and private sectors aimed at generating economic incentives that allow better income for legal rural activities. {Política Nacional contra las Drogas, 2010-2014, p.29} ~ Contribute to the comprehensive, convergent and sustainable development of the country, in order to generate growth and ""prosperity for all"". Thus, the pursuit of integral development will be aimed at addressing the structural causes and consequences of the drug problem, to improve the quality of life and human development of citizens {Política Nacional contra las Drogas, 2010-2014, p.52} ~ To promote sustainable management and use of natural resources and the environment {Política Nacional contra las Drogas, 2010-2014, p.62} ~ This policy, based on a promotional and social protection framework, that seeks to reduce the conditions of vulnerability and social exclusion that increase the risk of consumption, suffering adverse consequences, and relapse into a consumption that has already been overcome {Política Nacional contra las Drogas, 2010-2014, p.9} ~ Social inclusion processes that contribute to improve the quality of life of the affected population, control the territories affected and prevent the problem of drug trafficking from a social intervention approach and to control the sale and consumption of substances {Bases del Plan Nacional de Desarrollo, 2014-2018, p.387} ~ "
Colombia,COL,Human Rights,Prevalence and incidence of infectious diseases in prisons,No,n/a,0,n/a
Colombia,COL,Human Rights,Prevalence of drug use in prisons,No,n/a,0,n/a
Colombia,COL,Human Rights,Proportion of drug using inmates receiving MAT,No,n/a,0,n/a
Colombia,COL,Human Rights,Distribution of sterile injecting equipment in prisons,No,n/a,0,n/a
Colombia,COL,Human Rights,Disaggregated by gender,No,n/a,0,"In order to mitigate, it is necessary to prioritize the work with:[...] women of reproductive age... {Política Nacional Para La Reduccíon Del Consumo De Sustancias Psicoactivas Y Su Impacto, 2007, p.22} ~ The priority of the Policy will be any use of legal and illegal SPAs […] in pregnant or lactating women, in accordance with the principles of Social Protection and legislation. {Política Nacional Para La Reduccíon Del Consumo De Sustancias Psicoactivas Y Su Impacto, 2007, p.17} ~"
Colombia,COL,Human Rights,Disaggregated by country of birth,No,n/a,0,n/a
Colombia,COL,Human Rights,Disaggregated by ethnicity,No,n/a,0,"It has been designed to establish prior consultation processes for the eradication of illicit crops, in order to ensure respect for traditional uses the coca leaf, the free development of personality and previous participation and informed {Política Nacional contra las Drogas, 2010-2014, p.28} ~  Prioritize the containment of illicit crops in the areas of indigenous reservations and territories of Afro-Colombians based on the improvement of the implementation of the prior consultation. The guarantee of the autonomous rights of indigenous communities should not detract from the deterioration of the security and development of these communities. Guaranteeing rights is in essence to establish expedited mechanisms of coordination and implementation where the guarantee and effective enjoyment of human rights prevail and are consolidated. {Bases del Plan Nacional de Desarrollo, 2014-2018, p.385} ~ "
Colombia,COL,Human Rights,Other vulnerable population,No,n/a,0,"This is how the National Plan for Territorial Consolidation (PNCT) [1] was designed and implemented, which seeks to achieve consolidated areas that guarantee in a sustainable manner an environment of security and peace, as well as the strengthening of democratic institutions, free exercise of citizens' rights and the creation of conditions for their human development. This is done through the articulation of concentrated and sustained state efforts in strategic areas of the national territory where there is a weak institutional presence of the State, a high violation of Human Rights and violations of International Humanitarian Law, a presence of illicit crops and centers of Seriousness of the threat of terrorism and drug trafficking and their interconnections. {Política Nacional contra las Drogas, 2010-2014, p.30} ~ Prevention has promoted the implementation of national programs aimed at different key populations: school, workers and prisoners, among others. There are also programs for substances specifically, such as alcoholic beverages and drugs {Política Nacional contra las Drogas, 2010-2014, p.42} ~  "
Colombia,COL,Human Rights,"Programs and services targeted towards vulnerable groups (gender, age, ethnicity, status)***",No,n/a,0,"In order to mitigate, it is necessary to prioritize the work with:[...] women of reproductive age... {Política Nacional Para La Reduccíon Del Consumo De Sustancias Psicoactivas Y Su Impacto, 2007, p.22} ~ The priority of the Policy will be any use of legal and illegal SPAs […] in pregnant or lactating women, in accordance with the principles of Social Protection and legislation. {Política Nacional Para La Reduccíon Del Consumo De Sustancias Psicoactivas Y Su Impacto, 2007, p.17} ~ It has been designed to establish prior consultation processes for the eradication of illicit crops, in order to ensure respect for traditional uses the coca leaf, the free development of personality and previous participation and informed {Política Nacional contra las Drogas, 2010-2014, p.28} ~  Prevention has promoted the implementation of national programs aimed at different key populations: school, workers and prisoners, among others. There are also programs for substances specifically, such as alcoholic beverages and drugs {Política Nacional contra las Drogas, 2010-2014, p.42} ~  Prioritize the containment of illicit crops in the areas of indigenous reservations and territories of Afro-Colombians based on the improvement of the implementation of the prior consultation. The guarantee of the autonomous rights of indigenous communities should not detract from the deterioration of the security and development of these communities. Guaranteeing rights is in essence to establish expedited mechanisms of coordination and implementation where the guarantee and effective enjoyment of human rights prevail and are consolidated. {Bases del Plan Nacional de Desarrollo, 2014-2018, p.385} ~ This is how the National Plan for Territorial Consolidation (PNCT) [1] was designed and implemented, which seeks to achieve consolidated areas that guarantee in a sustainable manner an environment of security and peace, as well as the strengthening of democratic institutions, free exercise of citizens' rights and the creation of conditions for their human development. This is done through the articulation of concentrated and sustained state efforts in strategic areas of the national territory where there is a weak institutional presence of the State, a high violation of Human Rights and violations of International Humanitarian Law, a presence of illicit crops and centers of Seriousness of the threat of terrorism and drug trafficking and their interconnections. {Política Nacional contra las Drogas, 2010-2014, p.30} ~ Prevention has promoted the implementation of national programs aimed at different key populations: school, workers and prisoners, among others. There are also programs for substances specifically, such as alcoholic beverages and drugs {Política Nacional contra las Drogas, 2010-2014, p.42} ~ "
Colombia,COL,Human Rights,Other/too general goals/metrics,Yes,"% Of local communities involved in stigma and discrimination reduction activities, prepared for action {Plan nacional de respuesta al consumo emergente de heroína y otras drogas por vía inyectada, 2013, p.50} ~ Number of consumers who recorded having lived social inclusion actions by their local community {Plan nacional de respuesta al consumo emergente de heroína y otras drogas por vía inyectada, 2013, p.50} ~ Number of people who have used some of the tools to exercise their rights {Plan nacional de respuesta al consumo emergente de heroína y otras drogas por vía inyectada, 2013, p.49} ~",3,"In short, a political practice whose course is the pursuit of human development, the rights approach and the citizen's exercise, as a bet to achieve quality of life, well-being and reduce the conditions of vulnerability to a phenomenon like the consumption of SPA, is clearly demanding {Política Nacional Para La Reduccíon Del Consumo De Sustancias Psicoactivas Y Su Impacto, 2007, p.10} ~ To promote the reduction of stigma and discrimination against the consumers of alcohol and other SPA and enable their recovery from social inclusion system opportunities. {Política Nacional contra las Drogas, 2010-2014, p.71} ~ Redefine the criminal policy approach, aimed at protecting the rights of the weakest cultivation and consumption links of the chain, which usually correspond to the affected populations with a greater degree of vulnerability, and which, at the same time, allows to attack with greater force the strongest links associated with organized crime and management of large illicit capital {Bases del Plan Nacional de Desarrollo, 2014-2018, p.384} ~  Reduce the impacts of deprivation of liberty, as well as overcrowding and human rights violations associated with it - alternatives to imprisonment {Bases del Plan Nacional de Desarrollo, 2014-2018, p.386} ~ The higher prevalence rates in drug use in Colombia are a sign of the need to strengthen efforts and focus a strategy that allows to reconcile public health principles with the objectives of treatment to consumers. For this reason, the National Government intends to reconcile drug obligations with the fulfillment of human rights obligations by identifying strategies that will guide the negative effects of highly repressive drug policies within the framework of drug conventions {Bases del Plan Nacional de Desarrollo, 2014-2018, p.387} ~ It is understood by this component to all public policies, strategies and intersectoral community actions aimed at providing opportunities and environments that allow optimal deployment of individual and collective resources for the enjoyment of everyday life, establishing relationships based on respect, solidarity and the exercise of human rights for achieving the common good and human and social development {Plan Nacional Para La Promocion de la salud, la prevención, y la atención del consumo de sustancias psicoactivas, 2014-2021, p.19} ~  Likewise, it seeks to promote in an explicit and active way the protection and exercise of human rights for the groups affected by this problem, in particular the right to health and the dignity {Plan nacional de respuesta al consumo emergente de heroína y otras drogas por vía inyectada, 2013, p.17} ~ The following harms to reduce are: […] 8) Harms due to the abuse of authority or violation of social or health rights, damage due to social exclusion, stigma and discrimination {Plan nacional de respuesta al consumo emergente de heroína y otras drogas por vía inyectada, 2013, p.22} ~ 1.5 Social and community education and mobilization (awareness raising, stigma reduction and preparation for care and attention actions): Actions to sensitize and reduce stigma and development {Plan nacional de respuesta al consumo emergente de heroína y otras drogas por vía inyectada, 2013, p.29} ~ 100% of the communities in which health education actions are carried out, actions are taken to reduce stigma and discrimination {Plan nacional de respuesta al consumo emergente de heroína y otras drogas por vía inyectada, 2013, p.51} ~ "
