Luxembourg,LUX,Demand,Prevalence of drug use by type,Yes,"The prevalence of cocaine use as primary drug {2014 national report to the EMCDDA by the REITOX National Focal Point “Grand Duchy of Luxembourg”, 2013, p.9}~ The number of persons in contact with the national specialised network for (preferential) cannabis (%) {2014 national report to the EMCDDA by the REITOX National Focal Point “Grand Duchy of Luxembourg”, 2013, p.9}~ The proportion of poly-drug use {2014 national report to the EMCDDA by the REITOX National Focal Point “Grand Duchy of Luxembourg”, 2013, p.9}~ Lifetime prevalence of illicit drug use according to type of drugs. Total school population aged 12-18 years (valid %) {2014 national report to the EMCDDA by the REITOX National Focal Point “Grand Duchy of Luxembourg”, 2013, p.38}~ Lifetime prevalence according to age and type of drugs (valid %) {2014 national report to the EMCDDA by the REITOX National Focal Point “Grand Duchy of Luxembourg”, 2013, p.39}~ Longitudinal lifetime prevalence data according to type of drugs in age group 15-16 years. (valid %) {2014 national report to the EMCDDA by the REITOX National Focal Point “Grand Duchy of Luxembourg”, 2013, p.40}~ Longitudinal lifetime prevalence data according to type of drugs in age group 13-14 years. (valid %) {2014 national report to the EMCDDA by the REITOX National Focal Point “Grand Duchy of Luxembourg”, 2013, p.40}~ Last 12 months prevalence of illicit drug use according to type of drugs. Total school population aged 12-18 years (valid %) {2014 national report to the EMCDDA by the REITOX National Focal Point “Grand Duchy of Luxembourg”, 2013, p.40}~ Last 12 months prevalence according to age and type of drugs (valid %) {2014 national report to the EMCDDA by the REITOX National Focal Point “Grand Duchy of Luxembourg”, 2013, p.40}~ Last 30 days prevalence according to type of drugs: school population - 13-20 years {2014 national report to the EMCDDA by the REITOX National Focal Point “Grand Duchy of Luxembourg”, 2013, p.42}~ Lifetime, last 12 months and last 30 days prevalence of cannabis use. Age 12-18 years (valid %) {2014 national report to the EMCDDA by the REITOX National Focal Point “Grand Duchy of Luxembourg”, 2013, p.42}~ Cannabis prevalence rates according to age categories 11 – 15 years {2014 national report to the EMCDDA by the REITOX National Focal Point “Grand Duchy of Luxembourg”, 2013, p.43}~ Last 12 months prevalence of cannabis use according to gender. Age: 15 years. {2014 national report to the EMCDDA by the REITOX National Focal Point “Grand Duchy of Luxembourg”, 2013, p.43}~ Last 30 days prevalence of cannabis use according to gender. Age: 15 years. {2014 national report to the EMCDDA by the REITOX National Focal Point “Grand Duchy of Luxembourg”, 2013, p.43}~ Last 30 days cannabis prevalence according to age (valid %) {2014 national report to the EMCDDA by the REITOX National Focal Point “Grand Duchy of Luxembourg”, 2013, p.44}~ Main characteristics of PDU indexed by the national drug monitoring system, RELIS (valid percentage): Mean age - Primary drug: opiates, cocaine, others - Poly drug use – Primary Opiates Administration Mode {2014 national report to the EMCDDA by the REITOX National Focal Point “Grand Duchy of Luxembourg”, 2013, p.74}~ Clients core statistics IMPULS 2000 – 2013: Number of episodes, Referral from the criminal Justice system, Gender distribution, Age distribution, Main substance involved {p.119}~ male/female ratio of the PDU population {2014 national report to the EMCDDA by the REITOX National Focal Point “Grand Duchy of Luxembourg”, 2013, p.8}~ Cannabis prevalence (male/female ratio) {National report on the state of the drugs phenomenon: Grand Duchy of Luxembourg, 2016, p.18}~ Lifetime cannabis prevalence rates {National report on the state of the drugs phenomenon: Grand Duchy of Luxembourg, 2016, p.18}~ Percentage of youngsters aged 15 who have already used cannabis once in their lifetime {National report on the state of the drugs phenomenon: Grand Duchy of Luxembourg, 2016, p.18}~ the mean age at first use of cannabis and illicit drugs {National report on the state of the drugs phenomenon: Grand Duchy of Luxembourg, 2016, p.19}~ The prevalence of the use of cocaine as primary drug {National report on the state of the drugs phenomenon: Grand Duchy of Luxembourg, 2016, p.20}~ The proportion of poly-drug use {National report on the state of the drugs phenomenon: Grand Duchy of Luxembourg, 2016, p.20}~ Rates of polydrug use {National report on the state of the drugs phenomenon: Grand Duchy of Luxembourg, 2016, p.23}~ National life-time, last 12 months and last 30 days prevalence of cannabis use according to different age groups (valid %) {see figure 2.4, National report on the state of the drugs phenomenon: Grand Duchy of Luxembourg, 2016, p.48}~ Gender distribution in cannabis use prevalence according to different age groups: Lifetime, Last 12 months, Last 30 days {see table 2.1, National report on the state of the drugs phenomenon: Grand Duchy of Luxembourg, 2016, p.49}~ Lifetime prevalence according to age (valid %): Cannabis, Ecstasy, LSD, Cocaine, Heroin {see figure 2.5, National report on the state of the drugs phenomenon: Grand Duchy of Luxembourg, 2016,  p.51}~ Current and lifetime prevalence of cannabis use according to age: Cinema sample (valid %) (Fischer 2000) {see figure 2.6, p.52}~ Lifetime prevalence of illicit drug use according to type of drugs. Total school population aged 12-18 years (valid %): Cannabis, XTC type, ATS, Opiates, Cocaine, Solvents/glue, LSD, mushrooms {see figure 2.11, National report on the state of the drugs phenomenon: Grand Duchy of Luxembourg, 2016, p.56}~ Lifetime prevalence according to age and type of drugs {see figure 2.12, National report on the state of the drugs phenomenon: Grand Duchy of Luxembourg, 2016, p.57}~ Longitudinal lifetime prevalence data according to type of drugs in age group 15-16 years. (valid %) {see figure, 2.14, National report on the state of the drugs phenomenon: Grand Duchy of Luxembourg, 2016,  p.58}~ Longitudinal lifetime prevalence data according to type of drugs in age group 13-14 years. (valid %) {see figure 2.15, National report on the state of the drugs phenomenon: Grand Duchy of Luxembourg, 2016,  p.58}~ Last 12 months prevalence of illicit drug use according to type of drugs. Total school population aged 12-18 years (valid %) (HBSC 1999 – 2010) {see figure 2.16, National report on the state of the drugs phenomenon: Grand Duchy of Luxembourg, 2016, p.59}~ Last 12 months prevalence according to age and type of drugs (valid %) (HBSC 2010): 12 – 18 years {see figure 2.17, National report on the state of the drugs phenomenon: Grand Duchy of Luxembourg, 2016,  p.59}~ Last 30 days prevalence according to type of drugs: school population - 13-20 years: Cannabis, Heroin, Cocaine, Ecstasy, LSD, Psilocybin {see figure 2.18, National report on the state of the drugs phenomenon: Grand Duchy of Luxembourg, 2016,  p.60}~ Lifetime, last 12 months and last 30 days prevalence of cannabis use. Age 12-18 years (valid %) (HBSC 1999 - 2010) {see figure 2.19, National report on the state of the drugs phenomenon: Grand Duchy of Luxembourg, 2016,  p.61}~ HBSC 2010: Cannabis prevalence rates according to age categories 11 – 15 years {see table 2.6, National report on the state of the drugs phenomenon: Grand Duchy of Luxembourg, 2016, p.62}~ Lifetime prevalence of cannabis use according to gender. Age: 15 years. (HBSC 2002 - 2014) {see figure 2.20, National report on the state of the drugs phenomenon: Grand Duchy of Luxembourg, 2016, p.62}~ Last 12 months prevalence of cannabis use according to gender. Age: 15 years. (HBSC 2002 - 2010) {see figure 2.21, National report on the state of the drugs phenomenon: Grand Duchy of Luxembourg, 2016,  p.62}~ Last 30 days prevalence of cannabis use according to gender. Age: 15 years. (HBSC 2006 - 2014) {see figure 2.22, National report on the state of the drugs phenomenon: Grand Duchy of Luxembourg, 2016, p.63}~ Last 30 days cannabis prevalence according to age (valid %) (HBSC 2010) {see figure 2.23, National report on the state of the drugs phenomenon: Grand Duchy of Luxembourg, 2016,  p.63}~ Main characteristics of PDU indexed by the national drug monitoring system, RELIS (valid percentage): Gender, Nationality, Mean age, Primary Drug, Polydrug use, primary opiates administration mode {see table 4.2, National report on the state of the drugs phenomenon: Grand Duchy of Luxembourg, 2016, p.100) ~  Clients core statistics IMPULS 2000 – 2015: Number of episodes, Referral from the criminal Justice system (%), Gender distribution (%), Age distribution (%), Main substance involved (%). {see table 9.5, National report on the state of the drugs phenomenon: Grand Duchy of Luxembourg, 2016, p.145} ~",44,
Luxembourg,LUX,Demand,Level of coverage of inpatient treatment,Yes,"Number of drug treatment demanders: Outpatient: Drug Free, Substitution, Inpatient: Specialised, and Hospital Care, Low-Threshold Agencies (Contacts) {2014 national report to the EMCDDA by the REITOX National Focal Point “Grand Duchy of Luxembourg”, 2013, p.85}~ The number of adult inpatient clients {2014 national report to the EMCDDA by the REITOX National Focal Point “Grand Duchy of Luxembourg”, 2013, p.9}~ Number of adult clients in in – and out-patient clinics {2014 national report to the EMCDDA by the REITOX National Focal Point “Grand Duchy of Luxembourg”, 2013, p.86}~ Drug-related institutional contacts (Inter-institutional multiple counting included) - NUMBER OF ADMISSIONS NUMBER OF CONTACTS (Low threshold) & NUMBER OF DRUG TREATMENT DEMANDERS (intra-institutional multiple counts excluded): Outpatient (Drug free, Substitution), Inpatient (Specialised, Hospital Care), Low threshold agencies contacts {see table 5.1,National report on the state of the drugs phenomenon: Grand Duchy of Luxembourg, 2016,  p.111}~ The number of adult specialised inpatient treatment demanders {National report on the state of the drugs phenomenon: Grand Duchy of Luxembourg, 2016, p.20}~ ",5,
Luxembourg,LUX,Demand,Coverage of non MAT treatment or unspecified treatment,Yes,"Number of drug treatment demanders: Outpatient: Drug Free, Substitution, Inpatient: Specialised, and Hospital Care, Low-Threshold Agencies (Contacts) {2014 national report to the EMCDDA by the REITOX National Focal Point “Grand Duchy of Luxembourg”, 2013, p.85}~ Number of PDU (problem drug use) person-contacts {2014 national report to the EMCDDA by the REITOX National Focal Point “Grand Duchy of Luxembourg”, 2013, p.8}~ number of users who have been indexed by national specialised drug demand reduction agencies {2014 national report to the EMCDDA by the REITOX National Focal Point “Grand Duchy of Luxembourg”, 2013, p.8}~ The number of adult outpatient clients {2014 national report to the EMCDDA by the REITOX National Focal Point “Grand Duchy of Luxembourg”, 2013, p.9}~ Number of adult clients in in – and out-patient clinics {2014 national report to the EMCDDA by the REITOX National Focal Point “Grand Duchy of Luxembourg”, 2013, p.86}~ Proportion of first treatment demanders {2014 national report to the EMCDDA by the REITOX National Focal Point “Grand Duchy of Luxembourg”, 2013, p.86}~ The prevalence of cocaine use-related treatment demands {2014 national report to the EMCDDA by the REITOX National Focal Point “Grand Duchy of Luxembourg”, 2013, p.86}~ The prevalence of heroin use-related treatment demands {2014 national report to the EMCDDA by the REITOX National Focal Point “Grand Duchy of Luxembourg”, 2013, p.86}~ proportion of indexed non-native PDU {2014 national report to the EMCDDA by the REITOX National Focal Point “Grand Duchy of Luxembourg”, 2013, p.8}~ Main characteristics of PDU indexed by the national drug monitoring system, RELIS (valid percentage): Gender: Male/Female, Nationality: Natives/Non-natives - of which Portuguese French Others {2014 national report to the EMCDDA by the REITOX National Focal Point “Grand Duchy of Luxembourg”, 2013, p.74}~ Ratio of male/females in treatment, as well as the ratio of natives vs non-natives in treatment {2014 national report to the EMCDDA by the REITOX National Focal Point “Grand Duchy of Luxembourg”, 2013, p.86}~ Previous contacts with psychiatric services of RELIS indexed drug users. 1998- 2013 {2014 national report to the EMCDDA by the REITOX National Focal Point “Grand Duchy of Luxembourg”, 2013, p.95}~ Reasons for psychiatric care demands 1996-2013: Number in counselling, Number in confinement, Number in detoxification, Number in emergency, Other {2014 national report to the EMCDDA by the REITOX National Focal Point “Grand Duchy of Luxembourg”, 2013, p.95}~ number of pDU entered treatment or use low-threshold offers {National report on the state of the drugs phenomenon: Grand Duchy of Luxembourg, 2016, p.23}~ Drug-related institutional contacts (Inter-institutional multiple counting included) - NUMBER OF ADMISSIONS NUMBER OF CONTACTS (Low threshold) & NUMBER OF DRUG TREATMENT DEMANDERS (intra-institutional multiple counts excluded): Outpatient (Drug free, Substitution), Inpatient (Specialised, Hospital Care), Low threshold agencies contacts {see table 5.1, p.111}~ Previous contacts with psychiatric services of RELIS indexed drug users. 1998- 2015 {see figure 6.3, National report on the state of the drugs phenomenon: Grand Duchy of Luxembourg, 2016, p.119}~ Reasons for psychiatric care demands 1998-2015: Counselling, confinement, detoxification, emergency, other {see figure 6.4, National report on the state of the drugs phenomenon: Grand Duchy of Luxembourg, 2016, p.120}~ The number of persons in contact with the national specialised network for (preferential) cannabis use {National report on the state of the drugs phenomenon: Grand Duchy of Luxembourg, 2016, p.20}~ The number of adult outpatient clients and hospital based treatments { National report on the state of the drugs phenomenon: Grand Duchy of Luxembourg, 2016, p.20}~ Previous contacts with psychiatric services of RELIS indexed drug users. 1998- 2015 {see figure 6.3, National report on the state of the drugs phenomenon: Grand Duchy of Luxembourg, 2016, p.119}~ Reasons for psychiatric care demands 1998-2015: Counselling, confinement, detoxification, emergency, other {see figure 6.4, National report on the state of the drugs phenomenon: Grand Duchy of Luxembourg, 2016, p.120}~ Geographical coverage of specialised drug agencies in the Grand Duchy of Luxembourg {2014 national report to the EMCDDA by the REITOX National Focal Point “Grand Duchy of Luxembourg”, 2013, p.80}~ Ratio of clients in treatment who have completed a primary or complementary degree, secondary school, and those who have obtained a higher degree {2014 national report to the EMCDDA by the REITOX National Focal Point “Grand Duchy of Luxembourg”, 2013, p.86}~ Ratio of clients in treatment who report stable employment against those who are inactive or unemployed {2014 national report to the EMCDDA by the REITOX National Focal Point “Grand Duchy of Luxembourg”, 2013, p.86}~ Geographical coverage of specialised drug agencies in the Grand-Duchy of Luxembourg (status 2016) {see map 5.1, National report on the state of the drugs phenomenon: Grand Duchy of Luxembourg, 2016, p.101}~",25,
Luxembourg,LUX,Demand,Other/too general goals/metrics,Yes,"How should society’s drug problems be tackled? - Feedback from the community (%) - Tough measures against drug dealers and…, Information and prevention campaigns, Treatment and rehabilitation of drug users, Tough measures against drug users, Reduction of poverty and unemployment, More leisure opportunities, Making drugs legal {p.62}~ Substance consumed during the last 2 weeks {2014 national report to the EMCDDA by the REITOX National Focal Point “Grand Duchy of Luxembourg”, 2013, p.65}~ ",2,
Luxembourg,LUX,Supply,Size and value of illegal drug market,Yes,"The total number of persons involved in traffic {2014 national report to the EMCDDA by the REITOX National Focal Point “Grand Duchy of Luxembourg”, 2013, p.11}~ Ease of acquisition of drugs in Luxembourg (2002/2004): Near where I Live, In or near my school or college, At parties, In pubs/clubs {2014 national report to the EMCDDA by the REITOX National Focal Point “Grand Duchy of Luxembourg”, 2013, p.125}~ Ease of acquisition of drugs in Luxembourg (2008, 2011, 2014): Ease of access to heroin (if desired), Ease of access to cocaine (if desired), Ease of access to ecstasy (if desired), Ease of access to cannabis (if desired), Ease of access to alcohol (if desired), Ease of access to tobacco (if desired), Scale: very difficult, fairly difficult, fairly easy, very easy, dk/na {2014 national report to the EMCDDA by the REITOX National Focal Point “Grand Duchy of Luxembourg”, 2013, p.125, 126, 127}~ The total number of persons involved in traffic {National report on the state of the drugs phenomenon: Grand Duchy of Luxembourg, 2016, p.22}~ The origin of illicit drugs consumed in the G.-D. of Luxembourg {National report on the state of the drugs phenomenon: Grand Duchy of Luxembourg, 2016, National report on the state of the drugs phenomenon: Grand Duchy of Luxembourg, 2016, p.23}~ The proportion of non-natives involved in drug trafficking {National report on the state of the drugs phenomenon: Grand Duchy of Luxembourg, 2016, p.23}~ Ease of acquisition of drugs in Luxembourg (2014) {see table 10.1, National report on the state of the drugs phenomenon: Grand Duchy of Luxembourg, 2016,  p.154}~ ",7,
Luxembourg,LUX,Supply,Crop eradication,No,n/a,0,
Luxembourg,LUX,Supply,"Number of arrests, seizures and offences",Yes,"Number of arrests and foreclosures {Stratégie et plan d’action gouvernementaux en matière de lutte contre les drogues d’acquisition illicite et les addictions associées, 2015-2019, p.35}~ number of drug law offenders by supply reduction agencies {2014 national report to the EMCDDA by the REITOX National Focal Point “Grand Duchy of Luxembourg”, 2013, p.8}~ quantity of illicit substances seized {2014 national report to the EMCDDA by the REITOX National Focal Point “Grand Duchy of Luxembourg”, 2013, p.10}~ Number of cannabis and heroin seizures {2014 national report to the EMCDDA by the REITOX National Focal Point “Grand Duchy of Luxembourg”, 2013, p.11}~ Number of ecstasy seizures {2014 national report to the EMCDDA by the REITOX National Focal Point “Grand Duchy of Luxembourg”, 2013, p.11}~ The number of arrests {2014 national report to the EMCDDA by the REITOX National Focal Point “Grand Duchy of Luxembourg”, 2013, p.11}~ Arrests broken down by type of reporting institution (1995-2013): S.p.J, Gendarmerie, Police, Customs, Total {2014 national report to the EMCDDA by the REITOX National Focal Point “Grand Duchy of Luxembourg”, 2013, p.116}~ Total quantites of national yearly seizures: heroin, cocaine, ecstasy type (1988 - 2013) {2014 national report to the EMCDDA by the REITOX National Focal Point “Grand Duchy of Luxembourg”, 2013, p.129}~ Total number of national yearly seizures: Cannabis, Heroin, Cocaine, MDMA (1988 - 2013) {2014 national report to the EMCDDA by the REITOX National Focal Point “Grand Duchy of Luxembourg”, 2013, p.129}~ Number of offenders involved in seizures according to type of offence (1988-2013): Traffic, Traffic and/or use, Traffic and use, Traffic and/or use of heroin, Traffic and use of heroin {2014 national report to the EMCDDA by the REITOX National Focal Point “Grand Duchy of Luxembourg”, 2013, p.130}~ quantity of illicit substances seized {National report on the state of the drugs phenomenon: Grand Duchy of Luxembourg, 2016, p.22}~ quantities of seized cannabis {National report on the state of the drugs phenomenon: Grand Duchy of Luxembourg, 2016, p.22}~ quantities of cocaine seized { National report on the state of the drugs phenomenon: Grand Duchy of Luxembourg, 2016, p.22}~ quantities of heroin seized { National report on the state of the drugs phenomenon: Grand Duchy of Luxembourg, 2016, p.22}~ seizures of ecstasy type substances (MDMA, MDA, etc.) {National report on the state of the drugs phenomenon: Grand Duchy of Luxembourg, 2016, p.22}~ The number of police records for presumed offences {National report on the state of the drugs phenomenon: Grand Duchy of Luxembourg, 2016, p.22}~ The number of arrests for presumed drug offenses {National report on the state of the drugs phenomenon: Grand Duchy of Luxembourg, 2016, p.22}~ Number of new admissions into prison related to drug law offenses {National report on the state of the drugs phenomenon: Grand Duchy of Luxembourg, 2016, p.23}~ Arrests by type of reporting institution (1995-2015): S.p.J., Gendarmerie, Police, Customs, Total {see table 9.1, National report on the state of the drugs phenomenon: Grand Duchy of Luxembourg, 2016,  p.142}~ Distribution of drug law offenders (‘prévenus’) according to first offence and underage status (1992-2015) {see table 9.4, National report on the state of the drugs phenomenon: Grand Duchy of Luxembourg, 2016, p.144}~ Number of general admissions and the number of admissions according to drug-related convictions (DELIT ‘STUP’) in national prisons from 1989 to 2015 {see table 9.6, National report on the state of the drugs phenomenon: Grand Duchy of Luxembourg, 2016, p.146}~ Total quantities of national yearly seizures: heroin, cocaine, ecstasy type substances (1996 - 2015) {see figure 10.1, National report on the state of the drugs phenomenon: Grand Duchy of Luxembourg, 2016,  p.156}~ Total number of national yearly seizures: cannabis, heroin, cocaine, MDMA (1988 - 2015) {see figure 10.2, National report on the state of the drugs phenomenon: Grand Duchy of Luxembourg, 2016,  p.157}~ Number of offenders involved in seizures according to type of offence (2000-2015): Traffic, Traffic and/or use, traffic and use, traffic and/or use of heroin, traffic and use of heroin {see 10.3, National report on the state of the drugs phenomenon: Grand Duchy of Luxembourg, 2016, p.157}~ ",24,
Luxembourg,LUX,Supply,Law enforcement activity/interdiction in the market,Yes,"Number of actions made by police and customs at customs check {Stratégie et plan d’action gouvernementaux en matière de lutte contre les drogues d’acquisition illicite et les addictions associées, 2015-2019, p.33}~ Increase in the efficiency of work investigation {Stratégie et plan d’action gouvernementaux en matière de lutte contre les drogues d’acquisition illicite et les addictions associées, 2015-2019, p.34}~ Number of national law enforcement interventions (1995-2013): Number of Drug Law enforcement Records & Number of Offenders classified by S.p.J, gendarmerie, Police, Customs, Total {2014 national report to the EMCDDA by the REITOX National Focal Point “Grand Duchy of Luxembourg”, 2013, p.116}~ Number of national law enforcement interventions (1995-2015): S.p.J., Gendarmerie, Police, Customs, Total {see table 9.2, National report on the state of the drugs phenomenon: Grand Duchy of Luxembourg, 2016,  p.142}~ ",4,
Luxembourg,LUX,Supply,"Price, Purity, and Potency",Yes,"Price per unit evolution at the street level (1994-2013): Cannabis, Hashish, Marijuana, Cocaine, Heroin (brown), STA, Ecstasy, LSD {2014 national report to the EMCDDA by the REITOX National Focal Point “Grand Duchy of Luxembourg”, 2013, p.130}~ Purity of drugs at street level (1994-2013): Cannabis (THC), marijuana, hashish, Cocaine, Heroin (brown), STA, Ecstasy: MDMA, MDEA, MDA, Psylocine {2014 national report to the EMCDDA by the REITOX National Focal Point “Grand Duchy of Luxembourg”, 2013, p.131}~ purity of cocaine {National report on the state of the drugs phenomenon: Grand Duchy of Luxembourg, 2016, p.23}~ average heroin purity {National report on the state of the drugs phenomenon: Grand Duchy of Luxembourg, 2016, p.23}~ concentration of THC in cannabis: Attention has to be paid to the striking differences in maximum and minimum purities as well as to a high maximum concentration of ThC in cannabis products seized in Luxembourg in recent years { National report on the state of the drugs phenomenon: Grand Duchy of Luxembourg, 2016, p.23}~ Trends of prices for cocaine, heroin, and cannabis {National report on the state of the drugs phenomenon: Grand Duchy of Luxembourg, 2016, p.23}~ Price per unit evolution at the street level (1994-2015): Cannabis, Hashish, Marijuana, Cocaine, Heroin (brown), ATS, Ecstasy, LSD {see table 10.2, National report on the state of the drugs phenomenon: Grand Duchy of Luxembourg, 2016, p.158}~ Purity of drugs at street level (1996-2015): Cannabis (THC), Hashish, Marijuana, Cocaine, Heroin (brown), ATS, Ecstasy (MDMA) (MDEA) (MDA), Psylocine {see table 10.3, National report on the state of the drugs phenomenon: Grand Duchy of Luxembourg, 2016, p.159) ~  ",8,
