Country,ISO,Domain,Theme,Yes? (Metrics),Metrics,Total number of metrics,Priorities
France,FRA,Health,Level of availability of harm reduction services/harm reduction scale up ,Yes,"National survey of low-threshold structures (CAARUDs) conducted every 2 years, measures the number of users seen in these structures, the characteristics of these users and their use patterns. [...] The questions asked are on use (frequency, age of experimentation, administration route, equipment-sharing), screening (HIV, HBV and HCV) and social situation (social coverage, housing, level of education, support from friends and family) {National Report (2014 data) to the EMCDDA by the Reitox National Focal Point, 2015, p.104} ~ Network of outpatient treatment facilities (total number of units): Total number of units offering treatment services, broken down into: specialised drug treatment centres, low-threshold agencies, general/mental health care, prisons (see table 1) {National Report (2014 data) to the EMCDDA by the Reitox National Focal Point, 2015, p.84} ~ ",2,"By developing mobile CAARUD programmes in rural areas in particular {Government Plan for Combatting Drugs and Addictive Behavior, 2013-2017, p.33} ~ Promoting the Acceptability of Risk-Reduction Initiatives {Government Plan for Combatting Drugs and Addictive Behavior, 2013-2017, p.39} ~ By putting the emphasis on social mediation initiatives for the benefit of the users and inhabitants of residential areas affected by nuisances associated with drug use. Inhabitants of urban districts and elected representatives need to be involved in activities coming within the field of risk-reduction policy. Indeed, risk-reduction initiatives should combine objectives of public health and of public order {Government Plan for Combatting Drugs and Addictive Behavior, 2013-2017, p.39} ~ Extending the Field of Risk-Reduction to Potentially Addictive Substances as a Whole {Government Plan for Combatting Drugs and Addictive Behavior, 2013-2017, p.40} ~ By promoting access to treatment, including harm-reduction measures, for drug addicts as a human right, both at the bilateral level and in international forums {Government Plan for Combatting Drugs and Addictive Behavior, 2013-2017, p.91} ~ By assessing risk-reduction, support, and treatment schemes as well as users’ life paths {Government Plan for Combatting Drugs and Addictive Behavior, 2013-2017, p.77} ~ By trialling the opening of low-risk drug consumption rooms, in Paris to begin with, and then in one or two other cities, over the timespan of the plan {Government Plan for Combatting Drugs and Addictive Behavior, 2013-2017, p.41} ~ By assessing the value of sending risk-reduction equipment by mail for users located far from the facilities {Government Plan for Combatting Drugs and Addictive Behavior, 2013-2017, p.41} ~ By reinforcing the framework of risk-reduction initiatives in festive events through the validation of a national frame of reference. {Government Plan for Combatting Drugs and Addictive Behavior, 2013-2017, p.40} ~  Promote the acceptability of risk reduction programs {Plan gouvernemental de lutte contre les drogues et les conduites addictives. Plan d'actions 2013-2015, p.20} ~ Extend the scope of risk reduction to all products {Plan gouvernemental de lutte contre les drogues et les conduites addictives. Plan d'actions 2013-2015, p.20} ~ Increase access to harm reduction tools for people who do not want or can not access medical and social facilities (i.e., those who are stigmatized, those who are geographically distant or isolated, etc.) {Plan gouvernemental de lutte contre les drogues et les conduites addictives. Plan d'actions 2013-2015, p.22} ~ Promote the acceptability of risk reduction actions {Plan gouvernemental de lutte contre les drogues et les conduites addictives. Plan d'actions 2016-2017, p.13} ~ Specify the modalities in order to set risk/harm reduction actions (experimentation with syringe exchange programs, prevention of overdoses at the time of release from detention, etc.) {Plan gouvernemental de lutte contre les drogues et les conduites addictives. Plan d'actions 2016-2017, p.14} ~ Develop regional remote risk reduction centers (RDRs) based on existing CAARUDs: Publish and disseminate a guide for medical and social institutions wishing to experiment with a remote risk reduction program, to provide an Internet platform for the exchange of practices, to establish training in regions and support national risk reduction services at the national level during the period of this deployment. {Plan gouvernemental de lutte contre les drogues et les conduites addictives. Plan d'actions 2016-2017, p.14} ~ "
France,FRA,Health,Syringes distributed,Yes,"number of syringes distributed {National Report (2014 data) to the EMCDDA by the Reitox National Focal Point, 2015, p.134} ~",1,"Specify the modalities in order to set risk/harm reduction actions (experimentation with syringe exchange programs, prevention of overdoses at the time of release from detention, etc.) {Plan gouvernemental de lutte contre les drogues et les conduites addictives. Plan d'actions 2016-2017, p.14} ~"
France,FRA,Health,Level of access to substitution treatment (OST/MAT),Yes,"Number of clients in treatment: Total number of clients in treatment, Total OST clients, Total all clients entering treatment (See table 5) {National Report (2014 data) to the EMCDDA by the Reitox National Focal Point, 2015, p.90} ~ percentage of physicians prescribing OST {National Report (2014 data) to the EMCDDA by the Reitox National Focal Point, 2015, p.94} ~ Opioid substitution treatments: use of buprenorphine and methadone from 1995 to 2014 in terms of daily dose/1,000 inhabitants aged 20 to 39 years/day (See figure 5) {National Report (2014 data) to the EMCDDA by the Reitox National Focal Point, 2015, p.99} ~ Trends in numbers of clients in opioid substitution treatment, 2010-2014 (See figure 4) {National Report (2014 data) to the EMCDDA by the Reitox National Focal Point, 2015, p.101} ~ Monitoring of indicators for diversion (targeting individuals dispensed more than 32 mg buprenorphine per day, together with users having at least 5 prescribers or 5 pharmacies dispensing treatment) in the OSM reimbursement databases of the National Health Insurance Fund {National Report (2014 data) to the EMCDDA by the Reitox National Focal Point, 2015, p.102} ~ number of people reimbursed for OST {National Report (2014 data) to the EMCDDA by the Reitox National Focal Point, 2015, p.51} ~ ",6,"Improving the Quality of Healthcare for Patients receiving Opiate Substitution Treatment and Increasing the Accessibility Thereof by trialling and assessing new therapeutic methods {Government Plan for Combatting Drugs and Addictive Behavior, 2013-2017, p.35} ~ By increasing the accessibility of these treatments (opiate substitution treatment), in particular through greater mobility of the programmes (methadone bus) {Government Plan for Combatting Drugs and Addictive Behavior, 2013-2017, p.35} ~ By encouraging pharmacogenomics research in order to enable the range of addiction treatment medicines to be widened, including opiate substitution treatments. {Government Plan for Combatting Drugs and Addictive Behavior, 2013-2017, p.76} ~ Improve the quality of care for patients undergoing OST and improve the accessibility of these treatments {Plan gouvernemental de lutte contre les drogues et les conduites addictives. Plan d'actions 2013-2015, p.18} ~ Improve the quality of care for patients undergoing opioid substitution treatment (OST), and to develop their accessibility {Plan gouvernemental de lutte contre les drogues et les conduites addictives. Plan d'actions 2016-2017, p.11} ~ Putting in place the primoprescription of methadone in the city {Plan gouvernemental de lutte contre les drogues et les conduites addictives. Plan d'actions 2016-2017, p.11} ~"
France,FRA,Health,Prevalence of substance use disorders,No,No,0,No
France,FRA,Health,Prevalence of psychiatric comorbidities,Yes,"percentage of hospitalisations due to psychological problems not related to withdrawal (psychiatric comorbidities) {National Report (2014 data) to the EMCDDA by the Reitox National Focal Point, 2015, p.129} ~ ",1,"Identify psychiatric comorbidities and strengthen the integrated approach to concurrent disorders {Plan gouvernemental de lutte contre les drogues et les conduites addictives. Plan d'actions 2013-2015, p.17} ~ Deploy an integrated approach to psychiatric comorbidities: Need to carry out an inventory of the practices of partnerships for accompanying and monitoring people with a dual diagnosis: disorders linked to the consumption of psychoactive products and psychiatric disorders {Plan gouvernemental de lutte contre les drogues et les conduites addictives. Plan d'actions 2016-2017, p.10} ~"
France,FRA,Health,Prevalence of drug-related mortality,Yes,"Reduce deaths, suicides and attempted suicides linked to drug use {Plan gouvernemental de lutte contre les drogues et les conduites addictives. Plan d'actions 2013-2015, p.36} ~ Drug-related deaths {National Report (2014 data) to the EMCDDA by the Reitox National Focal Point, 2015,p.124} ~ percent of fatal overdoses {National Report (2014 data) to the EMCDDA by the Reitox National Focal Point, 2015, p.124} ~ number of AIDS deaths occurred among IDU (injection drug use) {National Report (2014 data) to the EMCDDA by the Reitox National Focal Point, 2015, p.128} ~ ",4,"While maintaining the primary objective of reducing infectious pathologies (HIV, hepatitis, sexually transmitted diseases and tuberculosis) and lethal overdoses, the extension of risk-reduction initiatives to products such as alcohol, tobacco, cannabis and poly-drug use, which are responsible for major damage to health and/or far-reaching negative social effects, is today absolutely essential {Government Plan for Combatting Drugs and Addictive Behavior, 2013-2017, p.40} ~  Establish and develop the accessibility of naloxone to prevent deaths due to an overdose from using opiates {Plan gouvernemental de lutte contre les drogues et les conduites addictives. Plan d'actions 2016-2017, p.11} ~ "
France,FRA,Health,Prevalence of drug-related infectious disease,Yes,"Reduce the prevalence and incidence of infectious diseases {Plan gouvernemental de lutte contre les drogues et les conduites addictives. Plan d'actions 2013-2015, p.23} ~ prevalence of HIV among drug-users {National Report (2014 data) to the EMCDDA by the Reitox National Focal Point, 2015, p.127} ~ prevalence of HCV among drug users {National Report (2014 data) to the EMCDDA by the Reitox National Focal Point, 2015, p.127} ",3,"While maintaining the primary objective of reducing infectious pathologies (HIV, hepatitis, sexually transmitted diseases and tuberculosis) and lethal overdoses, the extension of risk-reduction initiatives to products such as alcohol, tobacco, cannabis and poly-drug use, which are responsible for major damage to health and/or far-reaching negative social effects, is today absolutely essential {Government Plan for Combatting Drugs and Addictive Behavior, 2013-2017, p.40} ~  By increasing the availability of risk-reduction equipment and promoting its suitability for the various drug use practices, in order to contribute to reducing the prevalence of HIV and HCV {Government Plan for Combatting Drugs and Addictive Behavior, 2013-2017, p.41} ~"
France,FRA,Health,"Proportion of people who use drugs who engage in risky consumption (needle sharing, public injecting)",Yes,"Reduce at risk behaviours and practices, as well as reduce the prevalence of contaminations linked to the consumption of illicit drugs {Plan gouvernemental de lutte contre les drogues et les conduites addictives. Plan d'actions 2013-2015, p.23} ~ ",1,No
France,FRA,Health,Proportion of people who inject drugs who engage in HIV testing and/or treatment,No,No,0,"By promoting the treatment of somatic pathologies {Government Plan for Combatting Drugs and Addictive Behavior, 2013-2017, p.35} ~ By supporting the testing and follow-up of somatic pathologies associated with the use of psychoactive products, and HIV and hepatitis in particular (Rapid referral diagnosis test / Test rapide d’orientation diagnostique, Fibroscan) {Government Plan for Combatting Drugs and Addictive Behavior, 2013-2017, p.34} ~  Make the access to screening easier and improve the diagnosis and management of hepatic fibrosis associated with HCV infection {Plan gouvernemental de lutte contre les drogues et les conduites addictives. Plan d'actions 2013-2015, p.17} ~ Deploy an integrated approach to somatic comorbidities: Improve the detection and management of HCV and HIV infections among drug users, in particular through the use of the rapid diagnostic test device (TROD). Identify, describe and promote new organizational arrangements for HCV and / or HIV-positive drug users {Plan gouvernemental de lutte contre les drogues et les conduites addictives. Plan d'actions 2016-2017, p.10} ~ "
France,FRA,Health,Specialised training for addiction care,No,No,0,"By trialling common training programmes in the field of risk-reduction {Government Plan for Combatting Drugs and Addictive Behavior, 2013-2017, p.80} ~ By including short therapy strategies in the initial training programmes for all health professionals {Government Plan for Combatting Drugs and Addictive Behavior, 2013-2017, p.31} ~  By consolidating the skills of professionals working in young drug users’clinics, and of all those who are in contact with young drug users, in the detection of vulnerabilities and high-risk practices {Government Plan for Combatting Drugs and Addictive Behavior, 2013-2017, p.31} ~ Develop tools to support the training of professionals and users in the context of the availability of naloxone and the primary prescription of methadone in the city {Plan gouvernemental de lutte contre les drogues et les conduites addictives. Plan d'actions 2016-2017, p.11} ~ Strengthen the training of health professionals in contact with pregnant women, in terms of the identification and early management of addictive behaviors {Plan gouvernemental de lutte contre les drogues et les conduites addictives. Plan d'actions 2016-2017, p.32} ~ To develop the continuing education of doctors and nurses in health services, for the field of addictology in the armies {Plan gouvernemental de lutte contre les drogues et les conduites addictives. Plan d'actions 2016-2017, p.33} ~"
France,FRA,Health,Other/too general goals/metrics,Yes,"Reduce the prevalence of pathologies and traumas caused by the consumption of psychoactive products (especially punctual alcoholism) and behavioral addictions {Plan gouvernemental de lutte contre les drogues et les conduites addictives. Plan d'actions 2013-2015, p.20} ~ ENa-CAARUD surveys (OFDT): route of administration of buprenorphine by CAARUD clients {National Report (2014 data) to the EMCDDA by the Reitox National Focal Point, 2015,p.103} ~ Oppidum survey (ANSM): route of administration of buprenorphine by CSAPA or CAARUD clients {National Report (2014 data) to the EMCDDA by the Reitox National Focal Point, 2015, p.103} ~  ",3,"Basing public initiative upon Observation, Research and Assessment {Government Plan for Combatting Drugs and Addictive Behavior, 2013-2017, p.14} ~ Adapting the provision of primary and specialised healthcare {Government Plan for Combatting Drugs and Addictive Behavior, 2013-2017, p.31} ~ Reducing health risks and negative social impact {Government Plan for Combatting Drugs and Addictive Behavior, 2013-2017, p.39} ~ By reducing drug interactions through the creation of a functional liaison between urban pharmacies and CSAPAs for patients receiving care within these facilities {Government Plan for Combatting Drugs and Addictive Behavior, 2013-2017, p.35} ~ By coordinating and consolidating quantitative investigations into topics linked to health: the creation of a common platform for surveys among the population will enable pooling of the numerous French inquiries in the field of addictions {Government Plan for Combatting Drugs and Addictive Behavior, 2013-2017, p.75} ~ By stimulating neurosciences research into the molecular and cellular mechanisms {Government Plan for Combatting Drugs and Addictive Behavior, 2013-2017, p.74} ~ By consolidating research potential in the social sciences {Government Plan for Combatting Drugs and Addictive Behavior, 2013-2017, p.74} ~ Improve the management and care of psychoactive substance users in health facilities and penal institutions {Plan gouvernemental de lutte contre les drogues et les conduites addictives. Plan d'actions 2013-2015, p.14} ~ Support research on new treatments for addictive behaviors and addiction {Plan gouvernemental de lutte contre les drogues et les conduites addictives. Plan d'actions 2013-2015, p.18} ~ Reduce health risks and social harm {Plan gouvernemental de lutte contre les drogues et les conduites addictives. Plan d'actions 2013-2015, p.24} ~ Provide better access to care for people dependent on products {Plan gouvernemental de lutte contre les drogues et les conduites addictives. Plan d'actions 2013-2015, p.34} ~ "
France,FRA,Peace and Security,Prevalence of alcohol and drugs in accidents,Yes,"Reduce the prevalence of alcohol and drugs in accidents, especially fatal ones {Plan gouvernemental de lutte contre les drogues et les conduites addictives. Plan d'actions 2013-2015, p.35} ~",1,"Undertaking Educational Initiatives with Regard to the Dangers of Driving Under the Influence of Psychoactive Substances: By conducting specific communication and information campaigns. By raising driving licence applicants’ awareness of drug use problems within the framework of preparation for the Highway Code examination. {Government Plan for Combatting Drugs and Addictive Behavior, 2013-2017, p.68} ~ Reduce risky behaviours when it comes to driving {Plan gouvernemental de lutte contre les drogues et les conduites addictives. Plan d'actions 2013-2015, p.7} ~ Conduct educational activities on the dangers of consuming psychoactive substances while driving {Plan gouvernemental de lutte contre les drogues et les conduites addictives. Plan d'actions 2013-2015, p.35} ~ Implement actions that will increase individual's awareness of safety when it comes to hazards associated with driving under the influence, in order to reduce risky behaviour {Plan gouvernemental de lutte contre les drogues et les conduites addictives. Plan d'actions 2013-2015, p.7} ~ There is a need to better control driving under the influence of alcohol and/or after the use of narcotic drugs {Plan gouvernemental de lutte contre les drogues et les conduites addictives. Plan d'actions 2016-2017, p.25} ~ Generalize the use of a saliva sample confirming the use of narcotics in road safety {Plan gouvernemental de lutte contre les drogues et les conduites addictives. Plan d'actions 2016-2017, p.25} ~ Update data on the liability of alcohol and drugs in road accidents {Plan gouvernemental de lutte contre les drogues et les conduites addictives. Plan d'actions 2016-2017, p.25} ~ Put in place actions to raise awareness of road safety, taking into account the consumption of psychoactive products, in national education and agricultural establishments, and for individuals applying for their driver's license {Plan gouvernemental de lutte contre les drogues et les conduites addictives. Plan d'actions 2016-2017, p.25} ~"
France,FRA,Peace and Security,Annual number of public disorder acquisitive and violent crime,Yes,"percent of prosecutions related to driving under the influence of narcotics {National Report (2014 data) to the EMCDDA by the Reitox National Focal Point, 2015, p.158} ~",1,"Reduce exposed (public) consumption {Plan gouvernemental de lutte contre les drogues et les conduites addictives. Plan d'actions 2013-2015, p.7} ~ By better detection of the involvement of alcohol and drug use in offences involving assault causing physical harm {Government Plan for Combatting Drugs and Addictive Behavior, 2013-2017, p.67} ~ "
France,FRA,Peace and Security,Number of non-lethal drug market related violence,No,No,0,No
France,FRA,Peace and Security,Number of drug market related homicides and disappearances,No,No,0,No
France,FRA,Peace and Security,Economic Costs,No,No,0,No
France,FRA,Peace and Security,Other/too general goals/metrics,No,No,0,"Reduce health risks and social harm {Plan gouvernemental de lutte contre les drogues et les conduites addictives. Plan d'actions 2013-2015, p.24} ~ Investigate the effectiveness of the public's response to alcohol and drug offenses {Plan gouvernemental de lutte contre les drogues et les conduites addictives. Plan d'actions 2013-2015, p.34} ~ Implement new programs, in order to prevent recidivism related to addictions or substance use, for people in the hands of the justice system {Plan gouvernemental de lutte contre les drogues et les conduites addictives. Plan d'actions 2013-2015, p.9} ~ Improving the integration of young drug users in difficulty, as part of a care path {Plan gouvernemental de lutte contre les drogues et les conduites addictives. Plan d'actions 2013-2015, p.24} ~ Reduce recidivism linked to the consumption of a  psychoactive substance ... {Plan gouvernemental de lutte contre les drogues et les conduites addictives. Plan d'actions 2013-2015, p.34} ~ Assess the impact of programs to prevent recidivism on the course of care for the person in the hands of the justice system {Plan gouvernemental de lutte contre les drogues et les conduites addictives. Plan d'actions 2016-2017, p.5} ~ "
France,FRA,Development,Coverage of housing assistance for people who use drugs,No,No,0,"By facilitating the accommodation of minors who are in the greatest difficulties within residential CSAPAs {Government Plan for Combatting Drugs and Addictive Behavior, 2013-2017, p.34} ~ By promoting long-term housing benefits {Government Plan for Combatting Drugs and Addictive Behavior, 2013-2017, p.42} ~ Provide access to housing for individuals aged 25 and under, who use drugs and have no fixed address, or have an accommodation in conjunction with the Alternative Paid by the Day (TAPAJ) program {Plan gouvernemental de lutte contre les drogues et les conduites addictives. Plan d'actions 2016-2017, p.15} ~ "
France,FRA,Development,Coverage of social assistance for people who use drugs (not including housing),No,No,0,No
France,FRA,Development,Number of households enrolled in alternative development,No,No,0,No
France,FRA,Development,Other/too general goals/metrics,No,No,0,"By ensuring better geographical coverage of the specialist healthcare network {Government Plan for Combatting Drugs and Addictive Behavior, 2013-2017, p.41} ~ Reinforcing geographical and social accessibility {Government Plan for Combatting Drugs and Addictive Behavior, 2013-2017, p.33} ~ By adapting preventive actions [...] to the audiences most out of reach of traditional measures due to their insecure social situation. {Government Plan for Combatting Drugs and Addictive Behavior, 2013-2017, p.23} ~ By organising better geographical coverage of the specialist healthcare network {Government Plan for Combatting Drugs and Addictive Behavior, 2013-2017, p.44} ~ By increasing the mobility of facilities {Government Plan for Combatting Drugs and Addictive Behavior, 2013-2017, p.44} ~ Implement a geolocalisation system for specialized structures in priority neighborhoods, and facilitate access to these specialized structures for care and treatment {Plan gouvernemental de lutte contre les drogues et les conduites addictives. Plan d'actions 2013-2015, p.8} ~ Develop, implement and evaluate strategies, in order to adapt prevention efforts for the most geographically distant groups/population, who do not have access to devices (develop specific tools for prevention by relying on focus groups) {Plan gouvernemental de lutte contre les drogues et les conduites addictives. Plan d'actions 2013-2015, p.7} ~ Strengthen and improve the territorial and population coverage of liaison and addiction treatment teams (ELSA) {Plan gouvernemental de lutte contre les drogues et les conduites addictives. Plan d'actions 2016-2017, p.9} ~ Strengthen the medical-social offer and adapt the territorial distribution of medico-social institutions to the needs of the population {Plan gouvernemental de lutte contre les drogues et les conduites addictives. Plan d'actions 2016-2017, p.9} ~ "
France,FRA,Human Rights,Prevalence and incidence of infectious diseases in prisons,Yes,"Decrease the prevalence and incidence of infectious diseases in prisons {Plan gouvernemental de lutte contre les drogues et les conduites addictives. Plan d'actions 2013-2015, p.22} ~ prevalence of HIV and HCV in prison populations {National Report (2014 data) to the EMCDDA by the Reitox National Focal Point, 2015, p.170 & 173} ~ ",2,No
France,FRA,Human Rights,Prevalence of drug use in prisons,Yes,"the prevalence of injection drug use in prisons {National Report (2014 data) to the EMCDDA by the Reitox National Focal Point, 2015, p.173} ~ ",1,"By supporting improvement in the organisation of healthcare for addictions in prison, in particular at the time of release {Government Plan for Combatting Drugs and Addictive Behavior, 2013-2017, p.42} ~ Reducing the consumption [...] of illegal substances for incarcerated persons {Plan gouvernemental de lutte contre les drogues et les conduites addictives. Plan d'actions 2013-2015, p.9} ~"
